{
  "$schema": "https://json-schema.org/draft/2020-12/schema",
  "$id": "https://raw.githubusercontent.com/conuti-gmbh/bo4e-schema/master/schemas/v1/bo/AdHocSteuerkanal.schema.json",
  "title": "AdHocSteuerkanal",
  "type": "object",
  "properties": {
    "boTyp": {
      "$ref": "../enum/BOTyp.schema.json",
      "default": "AD_HOC_STEUERKANAL"
    },
    "versionStruktur": {
      "type": "string",
      "default": "1",
      "description": "versionStruktur"
    },
    "konfigurationsprodukt": {
      "type": "string",
      "faker": {
        "string.numeric": 14
      },
      "description": "konfigurationsprodukt"
    },
    "zieladresse": {
      "$ref": "../com/Zieladresse.schema.json"
    },
    "aussteller": {
      "$ref": "../com/Aussteller.schema.json"
    },
    "zertifikatsNutzer": {
      "$ref": "../com/ZertifikatsNutzer.schema.json"
    },
    "IPAdresseCLSDevice": {
      "$ref": "../com/IPAdresseCLSDevice.schema.json"
    }
  },
  "required": [
    "boTyp",
    "versionStruktur"
  ]
}
